{
    "$schema": "http://json-schema.org/draft-07/schema#",
    "type": "object",
    "properties": {
      "text": {
        "type": "string"
      },
      "permanent_url": {
        "type": "string"
      },
      "author": {
        "type": "string"
      },
      "Retweets": {
        "type": "integer"
      },
      "likes": {
        "type": "integer"
      }
    }
  }